<?xml version="1.0" encoding="UTF-8"?>
<!ELEMENT employees (employee)>
<!ELEMENT employee (name,email,phone)>
<!ELEMENT name (#PCDATA)>
<!ELEMENT phone (#PCDATA)>
<!ELEMENT email (#PCDATA)>
